{
  "schemaVersion": "flying.detailed-airport-manifest.v1",
  "manifestVersion": "2026.08.detailed-airports.0",
  "sourcePolicy": {
    "restrictedSourcePolicy": "no_aip_vfr_chart_geometry_without_permission",
    "defaultGeometryStatus": "derived_with_review_approval",
    "reviewStatus": "reviewer_approved",
    "notes": "Detailed scenery uses project-derived layouts and obstacle placeholders approved for simulator validation. It does not embed restricted AIP/VFR chart geometry."
  },
  "coverage": {
    "controlledPublicAirportIds": [
      "LKPR",
      "LKTB",
      "LKMT",
      "LKKV",
      "LKPD",
      "LKCS"
    ],
    "validationScenarioAirportIds": [
      "FPPV",
      "FPGS"
    ]
  },
  "airports": [
    {
      "airportId": "LKPR",
      "name": "Praha Ruzyne controlled public airport",
      "roles": ["controlled_public_airport"],
      "sourceReview": {
        "geometryStatus": "derived_with_review_approval",
        "reviewStatus": "reviewer_approved",
        "sourceVersion": "project-derived-controlled-public-airport-set-2026-08",
        "notes": "Controlled public airport identity only; detailed geometry is project-derived."
      },
      "scenery": {
        "taxiways": [
          {"id": "LKPR-TWY-NORTH", "widthM": 23, "surface": "asphalt", "centerline": [{"eastM": -620, "northM": 180}, {"eastM": 620, "northM": 180}], "sourceReview": {"geometryStatus": "derived_with_review_approval", "reviewStatus": "reviewer_approved", "sourceVersion": "detailed-airport-template-2026-08"}},
          {"id": "LKPR-TWY-SOUTH", "widthM": 23, "surface": "asphalt", "centerline": [{"eastM": -620, "northM": -210}, {"eastM": 620, "northM": -210}], "sourceReview": {"geometryStatus": "derived_with_review_approval", "reviewStatus": "reviewer_approved", "sourceVersion": "detailed-airport-template-2026-08"}}
        ],
        "aprons": [
          {"id": "LKPR-APR-MAIN", "surface": "concrete", "footprint": [{"eastM": -360, "northM": 40}, {"eastM": 390, "northM": 40}, {"eastM": 390, "northM": -180}, {"eastM": -360, "northM": -180}], "sourceReview": {"geometryStatus": "derived_with_review_approval", "reviewStatus": "reviewer_approved", "sourceVersion": "detailed-airport-template-2026-08"}}
        ],
        "stands": [
          {"id": "LKPR-STAND-1", "type": "gate", "position": {"eastM": -180, "northM": -80}, "headingDeg": 180, "sourceReview": {"geometryStatus": "derived_with_review_approval", "reviewStatus": "reviewer_approved", "sourceVersion": "detailed-airport-template-2026-08"}},
          {"id": "LKPR-STAND-2", "type": "remote", "position": {"eastM": 180, "northM": -80}, "headingDeg": 180, "sourceReview": {"geometryStatus": "derived_with_review_approval", "reviewStatus": "reviewer_approved", "sourceVersion": "detailed-airport-template-2026-08"}}
        ],
        "runwayTaxiSigns": [
          {"id": "LKPR-SIGN-HOLD-A", "legend": "HOLD A", "position": {"eastM": -470, "northM": 145}, "sourceReview": {"geometryStatus": "derived_with_review_approval", "reviewStatus": "reviewer_approved", "sourceVersion": "detailed-airport-template-2026-08"}},
          {"id": "LKPR-SIGN-RWY", "legend": "RWY", "position": {"eastM": 470, "northM": -175}, "sourceReview": {"geometryStatus": "derived_with_review_approval", "reviewStatus": "reviewer_approved", "sourceVersion": "detailed-airport-template-2026-08"}}
        ],
        "buildings": [
          {"id": "LKPR-TERMINAL", "kind": "terminal", "heightM": 18, "footprint": [{"eastM": -300, "northM": -240}, {"eastM": 320, "northM": -240}, {"eastM": 320, "northM": -330}, {"eastM": -300, "northM": -330}], "sourceReview": {"geometryStatus": "derived_with_review_approval", "reviewStatus": "reviewer_approved", "sourceVersion": "detailed-airport-template-2026-08"}}
        ],
        "hangars": [
          {"id": "LKPR-HANGAR-W", "heightM": 14, "footprint": [{"eastM": -560, "northM": -250}, {"eastM": -420, "northM": -250}, {"eastM": -420, "northM": -340}, {"eastM": -560, "northM": -340}], "sourceReview": {"geometryStatus": "derived_with_review_approval", "reviewStatus": "reviewer_approved", "sourceVersion": "detailed-airport-template-2026-08"}}
        ],
        "windsocks": [
          {"id": "LKPR-WS-1", "position": {"eastM": -520, "northM": 80}, "heightM": 6, "sourceReview": {"geometryStatus": "derived_with_review_approval", "reviewStatus": "reviewer_approved", "sourceVersion": "detailed-airport-template-2026-08"}}
        ],
        "lightingSystems": [
          {"id": "LKPR-RWY-LGT", "type": "runway_edge_threshold_centerline_papi", "papiAngleDeg": 3, "sourceReview": {"geometryStatus": "derived_with_review_approval", "reviewStatus": "reviewer_approved", "sourceVersion": "detailed-airport-template-2026-08"}},
          {"id": "LKPR-TWY-LGT", "type": "taxiway_edge_centerline", "sourceReview": {"geometryStatus": "derived_with_review_approval", "reviewStatus": "reviewer_approved", "sourceVersion": "detailed-airport-template-2026-08"}}
        ],
        "markings": [
          {"id": "LKPR-RWY-MARK", "type": "precision_runway_markings", "declaredDistanceStatus": "derived_review_approved", "sourceReview": {"geometryStatus": "derived_with_review_approval", "reviewStatus": "reviewer_approved", "sourceVersion": "detailed-airport-template-2026-08"}},
          {"id": "LKPR-APRON-MARK", "type": "stand_taxilane_service_road", "sourceReview": {"geometryStatus": "derived_with_review_approval", "reviewStatus": "reviewer_approved", "sourceVersion": "detailed-airport-template-2026-08"}}
        ],
        "significantObstacles": [
          {"id": "LKPR-OBS-APP-1", "type": "approach_light_mast", "position": {"eastM": -780, "northM": 0, "heightM": 12}, "protectedArea": "approach_departure", "sourceReview": {"geometryStatus": "derived_with_review_approval", "reviewStatus": "reviewer_approved", "sourceVersion": "detailed-airport-template-2026-08"}}
        ]
      },
      "collisionIntegration": {
        "wheelContactZones": [
          {"surfaceId": "LKPR-APR-MAIN", "maxVisualCollisionDeltaM": 0.02, "maxTerrainHeightDiscontinuityM": 0.03, "collisionSource": "detailed_airport_collision_mesh"},
          {"surfaceId": "LKPR-TWY-NORTH", "maxVisualCollisionDeltaM": 0.02, "maxTerrainHeightDiscontinuityM": 0.03, "collisionSource": "detailed_airport_collision_mesh"}
        ],
        "terrainTransitions": [
          {"surfaceId": "LKPR-APR-MAIN", "maxStepM": 0.03, "blendWidthM": 12, "status": "passed"},
          {"surfaceId": "LKPR-TWY-SOUTH", "maxStepM": 0.03, "blendWidthM": 10, "status": "passed"}
        ]
      }
    },
    {
      "airportId": "LKTB",
      "name": "Brno Turany controlled public airport",
      "roles": ["controlled_public_airport"],
      "sourceReview": {"geometryStatus": "derived_with_review_approval", "reviewStatus": "reviewer_approved", "sourceVersion": "project-derived-controlled-public-airport-set-2026-08"},
      "scenery": {
        "taxiways": [{"id": "LKTB-TWY-A", "widthM": 18, "surface": "asphalt", "centerline": [{"eastM": -420, "northM": 135}, {"eastM": 420, "northM": 135}], "sourceReview": {"geometryStatus": "derived_with_review_approval", "reviewStatus": "reviewer_approved", "sourceVersion": "detailed-airport-template-2026-08"}}],
        "aprons": [{"id": "LKTB-APR-MAIN", "surface": "concrete", "footprint": [{"eastM": -250, "northM": -30}, {"eastM": 250, "northM": -30}, {"eastM": 250, "northM": -165}, {"eastM": -250, "northM": -165}], "sourceReview": {"geometryStatus": "derived_with_review_approval", "reviewStatus": "reviewer_approved", "sourceVersion": "detailed-airport-template-2026-08"}}],
        "stands": [{"id": "LKTB-STAND-1", "type": "apron", "position": {"eastM": -80, "northM": -95}, "headingDeg": 175, "sourceReview": {"geometryStatus": "derived_with_review_approval", "reviewStatus": "reviewer_approved", "sourceVersion": "detailed-airport-template-2026-08"}}],
        "runwayTaxiSigns": [{"id": "LKTB-SIGN-A", "legend": "A", "position": {"eastM": -310, "northM": 110}, "sourceReview": {"geometryStatus": "derived_with_review_approval", "reviewStatus": "reviewer_approved", "sourceVersion": "detailed-airport-template-2026-08"}}],
        "buildings": [{"id": "LKTB-TERMINAL", "kind": "terminal", "heightM": 12, "footprint": [{"eastM": -180, "northM": -190}, {"eastM": 180, "northM": -190}, {"eastM": 180, "northM": -260}, {"eastM": -180, "northM": -260}], "sourceReview": {"geometryStatus": "derived_with_review_approval", "reviewStatus": "reviewer_approved", "sourceVersion": "detailed-airport-template-2026-08"}}],
        "hangars": [{"id": "LKTB-HANGAR-E", "heightM": 10, "footprint": [{"eastM": 270, "northM": -175}, {"eastM": 390, "northM": -175}, {"eastM": 390, "northM": -245}, {"eastM": 270, "northM": -245}], "sourceReview": {"geometryStatus": "derived_with_review_approval", "reviewStatus": "reviewer_approved", "sourceVersion": "detailed-airport-template-2026-08"}}],
        "windsocks": [{"id": "LKTB-WS-1", "position": {"eastM": -360, "northM": 80}, "heightM": 6, "sourceReview": {"geometryStatus": "derived_with_review_approval", "reviewStatus": "reviewer_approved", "sourceVersion": "detailed-airport-template-2026-08"}}],
        "lightingSystems": [{"id": "LKTB-RWY-LGT", "type": "runway_edge_threshold_papi", "papiAngleDeg": 3, "sourceReview": {"geometryStatus": "derived_with_review_approval", "reviewStatus": "reviewer_approved", "sourceVersion": "detailed-airport-template-2026-08"}}],
        "markings": [{"id": "LKTB-RWY-MARK", "type": "instrument_runway_markings", "declaredDistanceStatus": "derived_review_approved", "sourceReview": {"geometryStatus": "derived_with_review_approval", "reviewStatus": "reviewer_approved", "sourceVersion": "detailed-airport-template-2026-08"}}],